{
  "$ref": "#/definitions/locations",
  "definitions": {
    "locations": {
      "type": "object",
      "properties": {
        "key": {
          "type": "string"
        },
        "type": {
          "type": "string",
          "enum": [
            "clinic",
            "home-visits"
          ]
        },
        "name": {
          "type": "string"
        },
        "street": {
          "type": "string"
        },
        "postalCode": {
          "type": "string"
        },
        "locality": {
          "type": "string"
        },
        "region": {
          "type": "string"
        },
        "geo": {
          "type": "object",
          "properties": {
            "lat": {
              "type": "number"
            },
            "lng": {
              "type": "number"
            }
          },
          "required": [
            "lat",
            "lng"
          ],
          "additionalProperties": false
        },
        "mapUrl": {
          "type": "string"
        },
        "areaServed": {
          "type": "string"
        },
        "primary": {
          "type": "boolean",
          "default": false
        },
        "$schema": {
          "type": "string"
        }
      },
      "required": [
        "key",
        "type",
        "name",
        "areaServed"
      ],
      "additionalProperties": false
    }
  },
  "$schema": "http://json-schema.org/draft-07/schema#"
}